estabelecimento,estabelecimento_id,estabelecimento_tipo,usuario,data_avaliacao,data_visita,nota,titulo,conteudo,origem
Apocalipse,2390004,restaurante-review,B_Pena_Silva,2017-04-30,2017-05-26,4.0,"Almoço a kg bom","Tem cachaça e licor de cortesia. O preço do kg era de R$55,00. Além dos pratos mineiros (tutu, couve, costelinha,linguiça) também havia peixe e camarão. Sobremesas de doces de frutas muito bons, achei diferente o de tangerina.","Macaé, RJ"
Apocalipse,2390004,restaurante-review,Snell_Melo,2017-04-30,2017-04-26,5.0,"Nota 10","Excelente atendimento, comida farta e muita variedade. Tudo muito gostoso. O melhor lugar que comi em Diamantina. Recomendo","Jaguariúna, São Paulo, Brazil"
Apocalipse,2390004,restaurante-review,Alvaro A,2017-04-29,2017-04-26,3.0,"Esperava mais","Restaurante muito bem localizado, bem próximo ao Mercado Velho. Está situado no segundo piso de um casarão antigo. O salão é amplo e a decoração interessante. Em relação à comida, pouca variedade para um restaurante que cobra o preço dele. Há boas opções para salada, mas prato principal, como carnes, carboidratos e acompanhamentos, muito escasso. Preço não é baixo.","Belo Horizonte, MG"
Apocalipse,2390004,restaurante-review,JoaoMarcosF,2017-04-26,2017-04-26,4.0,"Boa comida - não é típica ","Self serviço de muito boa qualidade, pratos elaborados, mas não é comida típica. Recomendo para almoço!!","Petrópolis, RJ"
Apocalipse,2390004,restaurante-review,Renatosayao,2017-04-26,2017-04-26,2.0,"Muito fraco. ","Comida a quilo com variedade, porém, pouca coisa se salva. Muito fraco. Não me agradou em nada. Não voltaria a almoçar lá. A opinião foi a mesma das outras três pessoas que almoçaram comigo. Só existe, certamente, por falta de concorrência na cidade, que é pobre e tem poucas opções.","Florianópolis, Santa Catarina, Brazil"
Apocalipse,2390004,restaurante-review,Vívian A,2017-04-23,2017-04-26,4.0,"Almoco com bom preço","Ambiente agradável, comida com bom preço, considerando ser cidade turística. Boas opções no cardápio a quilo e bom atendimento.",indef
Apocalipse,2390004,restaurante-review,Luciano Santos L,2017-04-15,2017-04-26,5.0,"Restaurante 100%","Pratos super variados e saborosos, diversas saladas e também deliciosos pratos regionais. Muito bom!",indef
Apocalipse,2390004,restaurante-review,lilianeg2016,2017-04-15,2017-04-26,5.0,"Comida BBB","Se você estiver em Diamantina sugiro que almoce no Apocalipse. Restaurante à quilo, localizado no segundo andar de bonito casarão. A comida é boa, bonita e barata. Ótima opção para quem não quer gastar muito com restaurantes a la carte.","Belo Horizonte, MG"
Apocalipse,2390004,restaurante-review,NisticoCris,2017-04-12,2016-10-26,5.0,"Comida muito boa e é por Kilo","A comida é muito boa, foi almoçar os 4 dias que fiquei em Diamantina. O kilo é razoável para quem mora em SP, mas é bacana que é por kilo e come-se apenas o que tem vontade.",indef
Apocalipse,2390004,restaurante-review,Humberto07,2017-04-10,2017-04-26,5.0,"Lugar agradável e com excelente comida","A comida self service é muito variada, com pratos bem elaborados, lugar muito agradável com portas que dão visão para a paisagem da cidade.","Diamantina, MG"
Apocalipse,2390004,restaurante-review,wannut,2017-04-06,2017-03-26,5.0,"Comida excelente","Comida de primeira qualidade, muita variedade, mas, o preço é bemmm alto. Prepare a carteira na hora de pagar. Vale a pena ir pelo menos um dia para quem estiver turistando.","Diamantina, MG"
Apocalipse,2390004,restaurante-review,Jose Carlos M,2017-04-06,2017-04-26,4.0,"Boa surpresa em Diamantina!","Um self service de primeira qualidade pertinho do mercado de Diamantina. Pratos elaborados com muito capricho. Vale a pena. Preços não são baixos.",indef
Apocalipse,2390004,restaurante-review,CrisocaBE,2017-03-30,2017-03-26,5.0,"Muito bom!","Tem uma grande variedade de pratos e saladas, tudo muito limpo e gostoso. O atendimento é ótimo, dos garçons, a moça do caixa e o porteiro. Excelente!","Diamantina, MG"
Apocalipse,2390004,restaurante-review,Ana Lucia W,2017-03-30,2016-04-26,5.0,"Excelente comida","Melhor restaurante da cidade, fica na praça do mercado. Um atendimento de primeira, serviço self-service com uma grande variedade. Não é barato e em dias de grande movimento tem fila de espera.",indef
Apocalipse,2390004,restaurante-review,laurahelenab2016,2017-03-23,2017-03-26,3.0,"Buffet mediano ","O local e espaçoso, banheiro bom. Porém achei a comida cara e as opções do buffet fracas. Bom atendimento.","Belo Horizonte, MG"
Apocalipse,2390004,restaurante-review,Marcotulioquina,2017-03-22,2016-04-26,4.0,"Referencia em restaurante de Diamantina","Situado em frente ao mercado ( ponto principal de referencia em Diamantina) o restaurante Apocalipse esta situado no segundo andar de um casarão secular. A comida e variada mas tem as especialidades mineiras como tutu, feijão tropeiro, lombo, frango ao molho e doces.Vale a visita","Belo Horizonte, MG"
Apocalipse,2390004,restaurante-review,fernandohorota,2017-03-19,2017-02-26,5.0,"Ótimo buffet","Buffet muito variado e bem apresentado com opções até sofisticadas para este tipo de local. Ambiente bonito, bem atendido e com preço justo.","Jequié, BA"
Apocalipse,2390004,restaurante-review,CarlosCrispimL1,2017-03-16,2017-01-26,4.0,"Restaurante self service  com variado buffet,  bem no centro da cidade.","Boa comida variada, atendimento impecável,bom preço,bem localizado,ambiente bem decorado e acolhedor.",indef
Apocalipse,2390004,restaurante-review,CLEBERSON S,2017-03-14,2017-01-26,5.0,"Variedade da comida mineira","Excelente local para refeições após a feira do mercado velho. Comida variada e muito saborosa. A sobremesa também é muito saborosa e o local conta com aquela cerveja no ponto.",indef
Apocalipse,2390004,restaurante-review,vini_silvano,2017-03-12,2017-03-26,4.0,"Muito agradável ","Almocei com minha esposa e a comida é muito boa, bem apresentada e os funcionários são muito cordiais. Tem um bela vista.","Ribeirão Preto, SP"
Apocalipse,2390004,restaurante-review,CristalGill,2017-03-06,2017-03-26,5.0,"Bom custo benefício","Um agradável restaurante. Boa comida, variedade, bom atendimento e um bom preço. Excelente custo benefício. Recomendo. Acho que abre apenas para almoço.","Rio de Janeiro, RJ"
Apocalipse,2390004,restaurante-review,souzastefany,2017-02-15,2016-11-26,5.0,"Apocalipse","Lugar excelente com um ótimo atendimento além de oferecer pratos típicos e muito saborosos! Ambiente tranquilo e familiar.","Diamantina, MG"
Apocalipse,2390004,restaurante-review,alinesardinha10,2017-02-15,2016-12-26,5.0,"Excelente restaurante","Comida excelente, variada e saborosa. Vários tipo de salada, carnes e guarnições. Sem contar as sobremesas deliciosas! Recomendo!","Diamantina, MG"
Apocalipse,2390004,restaurante-review,Leneduarte,2017-02-14,2016-12-26,5.0,"O melhor restaurante no centro de Diamantina","A comida é bem variada, para todos os gostos e de excelente qualidade e ainda tem uma vista privilegiada para o Mercado velho. Ótimo para turistas.","Diamantina, MG"
Apocalipse,2390004,restaurante-review,vicosa27,2017-02-07,2017-02-26,5.0,"Comida mineira a quilo bem preparada.","Sua localização é privilegiada. Fica na praça central onde se localiza o Mercado e como o restaurante fica no andar superior, tem-se uma vista privilegiada.","Viçosa, MG"
Apocalipse,2390004,restaurante-review,vicosa27,2017-02-07,2017-02-26,5.0,"Almoço com comida a quilo, muito bom","A comida é variada bem preparada que vai desde salmão assado, leitoa, costelinha, etc. O prédio é no estilo local, localizado no andar superior que permite a vista da praça do Mercado.","Viçosa, MG"
Apocalipse,2390004,restaurante-review,Graciana G,2017-01-27,2017-01-26,5.0,"Perfeito!","Num casarão movimentado e agradável, mas com uma escadaria sofrida para quem tem limitações. Variedade e qualidade de sobra!!! Fico até sem educação e como além da medida. Tudo muuuiiiito gostoso. Preço justo! É um self service à quilo. Da sacada podemos observar todo o movimento do Mercado e sua praça, e com uma vista linda!",indef
Apocalipse,2390004,restaurante-review,Vincenzo18,2017-01-25,2016-12-26,4.0,"Muito bom, mas muito caro.","Almocei no Apocalipse duas vezes quando fui a Diamantina. Fui por indicação de um morador, achando que era mais restaurante a quilo para uma refeição comum do dia a dia. Al chegar, vi um restaurante com um ambiente muito agradável, bom atendimento e um lindo buffet.
No buffet, a comida era lindamente apresentada, totalmente diferente dos buffets comuns. Composto por pratos de comida mineira e pratos mais convencionais, como massas, carnes, muito torresmo, saladas diversas, além de sobremesas bem comuns e outras bem interessantes, como o delicioso doce de laranja cravina.
O atendimento também foi bem especial, com pessoas simpáticas e atenciosas desde as moças que abasteciam o buffet até os garçons. O único problema, na minha opinião, é o preço, já que se trata de um restaurante a quilo. Paguei quase 50,00 no meu prato, que não era grande, e uma bebida em lata. Ainda assim, indico.",indef
Apocalipse,2390004,restaurante-review,danielesenra,2017-01-17,2017-01-26,5.0,"Comida Maravilhosa!","O restaurante fica localizado num prédio histórico em frente ao Mercado do Tropeiro. Na entrada do restaurante é oferecida uma deliciosa batida de coco para “abrir” o apetite. Os pratos servidos no restaurante são de muito bom gosto e realmente saborosos, com muita variedade como massas, peixes, saladas e as típicas comidas mineiras. Após a refeição é oferecido como cortesia um delicioso café, chá e cappuccino. Ressalto o atendimento da Amanda, funcionaria muito atenciosa e simpática. Adorei o lugar.","Montes Claros, MG"
Apocalipse,2390004,restaurante-review,barbaraluma,2017-01-15,2017-01-26,4.0,"Almoço agradável  ","Restaurante self service bem localizado e com variado buffet. O ambiente é agradável, ademais, o custo benefício também é bom. Gostei da experiência.","Minas Gerais"
Apocalipse,2390004,restaurante-review,Jacquelined2390,2017-01-15,2017-01-26,3.0,"Bom self service","O restaurante não tem nada de extraordinário. É bom. O ambiente é agradável e os funcionários mais ainda.",indef
Apocalipse,2390004,restaurante-review,Paulo B,2017-01-11,2017-01-26,4.0,"Almoço","Restaurante atende somente para almoço. self service com comida tipica mineira saborosa. o atendimento é rápito e atencioso. bastante espaço entre as mesas",indef
Apocalipse,2390004,restaurante-review,Silvinhaji,2017-01-08,2016-12-26,4.0,"Comida por kg, boa mas ñ barata","Fui por indicação do Tripadvisor e meu sogro e minha sogra Tbm adoraram. Fui c/ meu marido e meus filhos, tem um mini parquinho lá dentro mas os meninos ñ quiseram brincar. Na entrada, tem um coquetel delicioso, pinga, café e cappuccino cortesia. O cappuccino é mto bom. A comida é bem gostosa mas o kg é um pouco Salgado. A sobremesa Tbm é por kg. A sobremesa achei normal. O ambiente é tranquilo mas tem uma escadona pra chegar lá.","Brasília, DF"
Apocalipse,2390004,restaurante-review,eloisa558,2017-01-06,2016-12-26,5.0,"Melhor restaurante da cidade!","Fui neste restaurante no último dia e confesso que foi a melhor refeição. O restaurante fica no centro histórico, em um prédio também histórico, próximo ao mercado municipal e é um restaurante self-service, 49,90 por kilo , mas valeu muito a pena, devido ás variedades tais como; peixes, massas, comidas típicas mineiras//// Eu experimentei o Tambaqui e estava delicioso! O restaurante também oferece, aperitivos, tais como cachaça, cachaça com abacaxi, maracujá de graça e pra fechar um delicioso café mineiro, também cortesia da casa///Simplesmente amei esse restaurante!","Ubatuba, SP"
Apocalipse,2390004,restaurante-review,edelfguimas,2017-01-05,2017-01-26,5.0,"O melhor de Diamantina!","Adoro este restaurante e o indico para os turistas. Culinária mineira e contemporânea, com pratos deliciosos, além de permitir vista para a Serra dos Cristais.","Belo Horizonte, MG"
Apocalipse,2390004,restaurante-review,Tamires M,2017-01-02,2016-12-26,5.0,"Muito bom","A comida é excelente, o melhor self-service de Diamantina. Muitas variedades de comida e ótima qualidade dos pratos.",indef
Apocalipse,2390004,restaurante-review,brunatbrant,2016-12-30,2016-12-26,5.0,"Almoço no Apocalipse ","Preço condizente com o nível de comida, fui com o preço de R$50/kilo. Restaurante excelente em atendimento, instalação e menu.",indef
Apocalipse,2390004,restaurante-review,Bruno O,2016-12-30,2016-12-26,5.0,"Gastronomia excelente a preço justo.","Os pratos servidos no restaurante são de muito bom gosto e realmente saborosos, o atendimento é ótimo. Deixo a dica para provarem as cervejas artesanais de diamantina, são excelentes.",indef
Apocalipse,2390004,restaurante-review,LuizFelipeSantos,2016-12-27,2016-12-26,5.0,"Ótimo","Boa comida, ambiente agradável e tranquilo com uma bela vista pela janela. Para quem vem para Diamantina",indef
Apocalipse,2390004,restaurante-review,AdrianoCesar,2016-12-25,2016-12-26,4.0,"Buffet com muitas opções ","Fomos almoçar no Apocalipse, por servir buffet por quilo, através da indicação de um pedestre. O buffet tem várias opções, contudo alguns pratos quentes já estavam frios. No geral, a comida, o ambiente e o atendimento foram satisfatórios.","Goiás, GO"
Apocalipse,2390004,restaurante-review,augustommartins,2016-12-23,2016-12-26,5.0,"Excelente comida. Me surpreendi","Adorei a comida desse restaurante. Tudo muito bom, com um toque de refinamento e ótimos ingredientes. O buffet muito bem montado e com tudo com excelente aparência e sabor.
À vista da praça é bem bonita, o restaurante fica em um segundo pavimento, subindo dois lances de escada. O ambiente é bem agradável e o atendimento muito bom, assim como em todos locais em que fui e Diamantina, sempre com um sorriso no rosto e boa vontade.","Goiânia, GO"
Apocalipse,2390004,restaurante-review,Faversani,2016-12-10,2016-11-26,4.0,"Bom self service, localização excelente.","É um restaurante localizado bem na praça do mercado. Funciona no sistema self service com boas opções de salada e pratos quentes, além de carnes grelhadas na hora. O salão é amplo e bastante confortável e o atendimento muito bom. Considerando a localização e o que oferecem o preço é ok. Se comparar com preços de Rio e São Paulo, é barato.","Mariana, MG"
Apocalipse,2390004,restaurante-review,Luiza P,2016-12-10,2016-12-26,5.0,"Boa opção para almoço ","Excelente localização, mas não tem acessibilidade para pessoas portadoras de deficiência. O restaurante fica no segundo andar e a vista é linda. A comida é bem variada e é deliciosa. Recomendo! O kg é R$ 52,50. Há boas opções de sobremesa. Atendimento nota 10! Banheiros limpos.","Belo Horizonte, MG"
Apocalipse,2390004,restaurante-review,Raiane F,2016-11-29,2016-09-26,5.0,"Boa comida","Boa comida, bom preço, variedade e bom atendimento, foi uma grata surpresa em Diamantina, recomendo.",indef
Apocalipse,2390004,restaurante-review,mirrezinha,2016-11-21,2016-11-26,4.0,"Comida boa","A comida é muito boa e variedade de opções é o que não falta. O valor do self-service é razoável. Uma delícia, vale a pena!","Belo Horizonte, MG"
Apocalipse,2390004,restaurante-review,EduBaeta5,2016-11-21,2016-11-26,4.0,"Local agradável e boa comida.","Sempre que vou a Diamantina almoço nesse local. Continua com a mesma qualidade, cardápio bem variado e bom atendimento. Preço é compatível com o que eles servem. Recomendo.","Belo Horizonte, MG"
Apocalipse,2390004,restaurante-review,brenocarlosbarbosa,2016-11-19,2016-11-26,4.0,"Ótima comida.","Ótima opção em Diamantina, restaurante com pratos muito bem preparados! Tem um preço na média de restaurantes self-service.",indef
Apocalipse,2390004,restaurante-review,José Marques So... S,2016-11-18,2016-09-26,5.0,"Um local aprazível e de excelente receptividade","As refeições são muito bem preparadas, dispostas num ambiente agradável, de boa ventilação e iluminação, devidamente bem acondicionados, com um atendimento diferenciado pelos vários funcionários.",indef
Apocalipse,2390004,restaurante-review,palmirafernandes,2016-11-16,2016-11-26,5.0,"Otima comida","O restaurante é muito bom. Tem uma variedade muito grande de pratos. Comi uma das melhores tortas de nozes da minha vida lá.","Santana de Parnaíba, SP"
Apocalipse,2390004,restaurante-review,janeoliveira,2016-11-15,2016-11-26,4.0,"restaurante sef service com fartas opções","O restaurante funciona no segundo andar de um sobrado, bem na praça do mercado velho de Diamantina. Comida boa e muitas variedades de pratos. Bom atendimento. Vale conhecer!","Juiz de Fora, MG"
Apocalipse,2390004,restaurante-review,CamilaQuerido,2016-11-14,2016-04-26,5.0,"Comida gourmet no quilo","A comida é muito, muito, muito boa! E pela comida que servem no restaurante eu diria que é comida gourmet no quilo. O preço é acessível e não chega a ser exorbitante. Vale a pena.","Paracatu, MG"
Apocalipse,2390004,restaurante-review,Bruno Z,2016-11-09,2016-11-26,4.0,"Self-Service muito bom.","Recomendo para almoço. Self-Service farto e com muitas opções de escolha. O valor não é alto nem baixo classificaria como intermediário. O ambiente é bem arejado e gostoso.",indef
Apocalipse,2390004,restaurante-review,Anatércia M,2016-11-07,2016-04-26,4.0,"um dos melhores da cidade!","Ótimo restaurante , o preço é meio salgado,mas, a qualidade e variedade da comida compensa, uma boa opção de diversidade pra quem não gosta só de comida mineira!",indef
Apocalipse,2390004,restaurante-review,Gilberto S,2016-11-06,2016-10-26,4.0,"almoço","self service variado e de qualidade , local arejado e varandas com magnifica vista e otimo local para fotografias",indef
Apocalipse,2390004,restaurante-review,RickVieira29,2016-11-05,2016-11-26,4.0,"Ótimo restaurante a kilo ","Restaurante com grande variedade de comida. Fica instalado num belo casarão colonial e comporta uma grande quantidade de pessoas, Excelente para grupos.","Salvador, BA"
Apocalipse,2390004,restaurante-review,Rogerio_Barroso,2016-11-04,2016-10-26,4.0,"Excelente localização, com uma vista incrível","O restaurante fica bem em frente ao antigo mercado, no segundo andar e com uma vista incrível. É um salão bem charmoso e só peca mesmo pela pouca variedade de comidas típicas mineiras. Aliás, senti muita falta de restaurantes tipicamente mineiros em Diamantina, inclusive com um deles que fechou para vender somente cervejas durante o dia da vesperata.","Rio Branco, AC"
Apocalipse,2390004,restaurante-review,IranJoseOliveira,2016-11-02,2016-03-26,5.0,"Alimentação","Pratos variados e de excelente sabor; alimentação perfeita. Sobremesas incríveis; degustação inesquecível!","Diamantina, MG"
Apocalipse,2390004,restaurante-review,Gilcal,2016-10-29,2016-06-26,4.0,"BOA COMIDA","Tem o conceito de ser o melhor da cidade. A localização é muito boa, ao lado do mercado e a vista é interessante. O acesso ao restaurante é por uma escada longa e íngreme, o que dificulta a ida de pessoas com dificuldade de locomoção e praticamente impossibilita a de bandeirantes. O atendimento é ótimo e o ambiente acolhedor.
A comida é boa e variada, servida a quilo, com um preço justo.","Montes Claros, MG"
Apocalipse,2390004,restaurante-review,Rodolfo G,2016-10-28,2016-10-26,4.0,"Buffet por quilo variado","Buffet por quilo variado e de boa qualidade. Boa localização perto do mercado velho. Ambiente agradável.",indef
Apocalipse,2390004,restaurante-review,GrandTour464150,2016-10-28,2016-10-26,5.0,"Para almoço o melhor da cidade!!","Sensacional. Muita variedade, e para nós que somoa bem enjoados com a comida a nota é 10!!!! Restaurante limpo, super organizado, comida mineira deliciosa!",indef
Apocalipse,2390004,restaurante-review,tessitore_antonio,2016-10-27,2016-10-26,5.0,"Boa comida.","Salão grande, agradável com bela vista para o Mercado. A comida, self-service, bastante variada, com alguns pratos regionais e outros mais conteporâneos. Com opção de carne grelhada na hora. Atendimento rápido e cortês.",indef
Apocalipse,2390004,restaurante-review,130deisys,2016-10-11,2016-10-26,4.0,"Muito bom","Ambiente agradável com buffet variado. Atendimento muito bom. Vista para o mercado velho privilegiada.",indef
Apocalipse,2390004,restaurante-review,399MarisaC399,2016-10-10,2016-07-26,3.0,"Buffet a quilo. Local maravilhoso. Preço alto para o que propõe.","O restaurante fica numa localização excelente - no 2º andar de um prédio bem bonito, com bela vista para o Mercado dos Tropeiros. O buffet de almoço é a quilo, bastante variado, mas como fica absolutamente lotado, sempre fica o sentimento de que a comida está mexida demais. O preço é alto, e não vale pelo que é servido. Como Diamantina é carente de opções, este acaba sendo um dos mais procurados.","Brasília, DF"
Apocalipse,2390004,restaurante-review,FlaviaReisFigueredo,2016-10-09,2016-10-26,1.0,"Não gostei!","Restaurante lotado! Comida normal, nada de extraordinário e nosso suco de Maracujá veio com plástico. O plástico foi batido junto com o suco. Experiência horrível!!!",indef
Apocalipse,2390004,restaurante-review,659karennc,2016-09-28,2016-09-26,5.0,"Maravilhoso!!!","Comida boa sem igual!! Muita variedade no self service, um salpicão mágico e sobremesas deliciosas. Os funcionários são educados e o restaurante muito bonito, com uma linda vista do Mercado.","Rio de Janeiro, RJ"
Apocalipse,2390004,restaurante-review,Wadingthon V,2016-09-28,2016-09-26,5.0,"Restaurante muito bom e sofisticado.","Tudo de bom. Almoço com muitas variedades de salada e pratos, comida bem saborosa e sofisticada, atendimento excelente.",indef
Apocalipse,2390004,restaurante-review,tosettoguilherme,2016-09-26,2016-09-26,5.0,"Muito bom!! Um dos melhores da cidade","Muito boa variedade de pratos, preço do self service compatível com o mercado, bom atendimento! Vale a pena!","São Paulo, SP"
Apocalipse,2390004,restaurante-review,MAmeliaC,2016-09-21,2016-09-26,3.0,"podia ser melhor1","restaurante mal iluminado, serviço demorado, pizza assada no forno a gás, poucos atendentes. Não recomendo.","Piquete, SP"
Apocalipse,2390004,restaurante-review,alexandreh2m,2016-09-19,2016-09-26,3.0,"Paga-se pelo preço da vista","Salão enorme e luxuoso com vista espetacular para a praça e Mercado dos Tropeiros. Comida boa mas talvez pelo horário em que o visitamos, muito mexida e pouca opção de saladas. Oferece Wi-Fi que nem sempre funciona (segundo informação do garçom que nos atendeu). Infelizmente fecha às 15h30m e, no período em que estivemos lá (sexta e sábado) não abriu à noite. Preço do quilo da comida muito caro. Vale visitar pela vista, e sugiro optar pelo marmitex, que, pelo que vi, é bem generoso e com preço muito mais em conta.","Porto Seguro, BA"
Apocalipse,2390004,restaurante-review,579eduardol,2016-09-18,2016-09-26,3.0,"Aceitável ","Chegamos tarde, depois de 13 horas, o que seria a única explicação para a comida apenas razoável servida. Preço alto pelo padrão esperado. Sobremesas variadas. Bem localizado. Bastante movimentado e considerado o melhor da região pelos nativos. Banheiros limpos. Ambiente amplo e preservado.","Rio de Janeiro, RJ"
Apocalipse,2390004,restaurante-review,701s_lviab,2016-09-13,2016-09-26,4.0,"Opções variadas ","Mesmo chegando tarde pra almoçar (por volta das 14:00 de um domingo), o buffet ainda tinha muitas e boas opções de saladas, peixes e carnes.","Belo Horizonte, MG"
Apocalipse,2390004,restaurante-review,HaydnPrates,2016-09-13,2016-09-26,4.0,"Diversidade e atendimento de qualidades","temos o costume, eu e minha família de pelo menos uma vez por semana almoçarmos no Apocalypse. Tem uma localização privilegiada na cidade de Diamantina, em plena praça do Mercado. O atendimento é sempre agradável, a comida sempre fesquinha e diversificada. O tempo todo nutricionistas e demais funcionárias fiscalizando o que há disponível.","Diamantina, MG"
Apocalipse,2390004,restaurante-review,RobertaCer,2016-09-12,2016-09-26,5.0,"Excelente opção em Diamantina principalmente aos domingos!","Para quem está a procura de um lugar para almoçar no domingo no centro de Diamantina, recomendo muito o Apocalipse. Fica em uma localização privilegiada (próximo ao mercado velho), com um atendimento impecável e um buffet variado. O preço é um pouco salgado, mas compensa pela a qualidade e diversidade da comida. Além de uma linda vista!","Belo Horizonte, MG"
Apocalipse,2390004,restaurante-review,Kellen H,2016-09-09,2016-05-26,5.0,"Perdição","Uma variedade de comida mineira da melhor qualidade! E as sobremesas também. Nossa, tudo delicioso! A vista era linda! Tudo muito agradável e bom atendimento. Deixou saudade...",indef
Apocalipse,2390004,restaurante-review,adilsoncloviso,2016-09-07,2016-09-26,4.0,"Comida boa bem variada","Comida self-service, muito variada. Local e apresentação dos pratos no self-service muito bem decorados com ótima apresentação.","Belo Horizonte, MG"
Apocalipse,2390004,restaurante-review,PatriciaDOP,2016-09-05,2016-09-26,5.0,"Grande variedade ","É um restaurante de comido amor quilo, mas bastante diferenciado. Localizado na praça do mercado em prédio típico. A variedade de pratos que apresenta é imensa, muito bem elaborados. O custo é muito acessível.","Lavras, MG"
Apocalipse,2390004,restaurante-review,patchim,2016-08-29,2016-08-26,4.0,"Self-service bom!","Apesar de ter ido em um dia lotado, fui muito bem atendida e a comida estava a contento. Muito gostosa. Destaco a batata chips que é feita na casa e a farofa de carne com vinagrete. Incrível!","Brasília, DF"
