estabelecimento,estabelecimento_id,estabelecimento_tipo,usuario,data_avaliacao,data_visita,nota,titulo,conteudo,origem
Café a Baiúca,5957859,restaurante-review,479lucianea,2017-02-15,2016-06-26,4.0,"melhor point Diamentina","Excelente bar bem no coração de Diamantina. As mesas ficam na rua , otimo atendimento e preço muito justo.","Sete Lagoas, MG"
Café a Baiúca,5957859,restaurante-review,Vanessa T,2017-01-13,2016-12-26,3.0,"pedidos trocados","Eu e o meu marido pedimos dois sanduíches, com alguns itens fora do padrão do cardápio. Demorou uma eternidade para ficar pronto, quando os sanduíches chegaram, o molho do meu sanduíche estava no sanduíche do meu marido e tinha ainda alguns outros ingredientes trocados. Como já tinha demorado muito, ficamos com preguiça de pedir para trocar. Atendimento muito ineficiente...",indef
Café a Baiúca,5957859,restaurante-review,eloisa558,2017-01-08,2016-12-26,4.0,"Pitoresco","Fui no A Baiuca á noite, e posso dizer que gostei muito////Fica na praça histórica da cidade, quase em frente a Catedral Metropolitana////O cardápio até que variado, resolvi pedir um sanduíche de salmão e estava muito gostoso///O preço é bom, paguei 23 reais, e foi um big sandwic, com direito a fritas e molho tipo tártaro///Mas além, de sanduíches, eles servem porções e vários tipo de bebidas e chopp////Eu experimentei a caipirinha feita com a famosa pinga, ' Dama da noite' , uma delícia////Pena que no dia 31 de dezembro, o bar fechou antes das 7 da noite, mas realmente é um local muito agradável de se ir, garçons atenciosos, porém serviço um pouco demorado/////","Ubatuba, SP"
Café a Baiúca,5957859,restaurante-review,brunatbrant,2017-01-06,2016-12-26,5.0,"Cerveja geladaça","Atendimento bacana e fica com mesinha bem na área central permitindo ver o movimento da rua. Adorei e é sim um lugar que quero voltar. Só não aproveitei a comida porque saí rápido.",indef
Café a Baiúca,5957859,restaurante-review,Adrianatata,2017-01-05,2017-01-26,5.0,"Centro da Vesperata","Fui ao local movida para conhecer onde é como acontecem as Vesperatas . Mas o bar de mais de 60 anos mostrou um cardápio impecável , farto , muito saboroso e a preços acessíveis . Cervejas geladas e de boa qualidade , para todos os bolsos . Atendimento ágil e competente , mesmo estando sempre lotado. Aberto todos os dias das 8 da manhã até meia noite. Finais de semana , q começa na quinta , vai até 2 da matina.","Salvador, BA"
Café a Baiúca,5957859,restaurante-review,Vitor672,2017-01-02,2016-12-26,2.0,"Faltou honestidade","Eu e minha mulher nos sentamos numa das mesas da rua. Pedi uma carne de sol com mandioca frita. Minha mulher pediu um suco de abacaxi e eu pedi uma taça de vinho Casa Valduga como constava no cardápio. Quando o vinho chegou, ao provar, duvidei se era o que tinha pedido. Fui ao balcão e pedi para ver a garrafa do vinho. Um empregado olha para o outro e diz que de fato Casa Valduga estava em falta. O que me serviram era um vinho suave, que não suporto. Ocorre que acharam que o turista não conhecia vinho. Erraram. Eu conheço vinho. Lastimável. Pedi uma coca cola, mas ficou a péssima impressão. Fraudar o cliente. Vender algo mais caro e oferecer algo muito mais barato. Mas a maioria bebe cerveja e esta avaliação não deve ter qualquer repercussão. Eu não bebo cerveja.","Rio de Janeiro, RJ"
Café a Baiúca,5957859,restaurante-review,José Marques So... S,2016-11-18,2016-09-26,5.0,"cafézinho de sempre e de boa qualidade.","Um local para curtir e ter oportunidade de conhecer os frequentadores habituais de Diamantina.Um ambiente onde os funcionários dispensam um bom atendimento, além de ser um local bastante aprazível e acolhedor, onde a diversidade dos frequentadores, fazem a diferença.",indef
Café a Baiúca,5957859,restaurante-review,palmirafernandes,2016-11-16,2016-11-26,4.0,"Comida boa e chopp gelado","A comida é muito boa o ambiente é muito agradável. O escondidinho de carne seca é muito bom e o chopp bem gelado.","Santana de Parnaíba, SP"
Café a Baiúca,5957859,restaurante-review,janeoliveira,2016-11-15,2016-11-26,5.0,"Bar com hamburguer ótimo","Bom pra tomar uma gelada, este bar oferece um hamburguer otimo! Localizado no centro histórico, bem próximo à catedral de Diamantina, numa ladeira com vários bares, lado a lado da rua, em alguns com música ao vivo.","Juiz de Fora, MG"
Café a Baiúca,5957859,restaurante-review,Priscila C,2016-11-15,2016-08-26,5.0,"Ótimo happy hour","Ótimo para passar divertidos momentos, tomando um chopp, comendo um petisco bem preparado e conversando com amigos!! Comi uma panqueca vegetariana muito gostosa!",indef
Café a Baiúca,5957859,restaurante-review,jbdiniz,2016-11-15,2016-11-26,3.0,"Custo benéficio não satisfatorio.","Restaurante normal, nada de excepcional que chame a atenção, tira gosto fraco, porém cerveja gelada, peca muito no atendimento, o garçon que nos atendeu não sabia nada sobre os pratos do local e nem mesmo sobre a cidade.","Belo Horizonte, MG"
Café a Baiúca,5957859,restaurante-review,Bruno Z,2016-11-09,2016-11-26,4.0,"Ótimo para um Cerveja","Não comemos no Café a Baiuca por isso não posso dizer nada da comida. Fica localizado em um dos points de Diamantina (onde tem uma quantidade maior de restaurantes. Lugar movimentado e muito bom para respirar o ar de uma cidade histórica. Quando tem vesperata ela acontece nessa rua.","Tiradentes, MG"
Café a Baiúca,5957859,restaurante-review,Alexandre Z,2016-11-07,2016-11-26,2.0,"Caro e atendimento demorado","Fui em dia de pouco movimento. Ainda assim demoraram uma hora pra fazer um sanduíche simples que pedi. Preço não é dos mais caros mas a qualidade dos produtos também não. A vantagem é a boa localização.",indef
Café a Baiúca,5957859,restaurante-review,Rogerio_Barroso,2016-11-04,2016-10-26,3.0,"Localizado bem no point de Diamantina","Este é um dos bares no point de Diamantina, onde ocorrem a vesperata. Cerveja gelada, apesar das marcas irem acabando ao longo do dia, demonstrando falta de planejamento. Petiscos bem servidos.","Rio Branco, AC"
Café a Baiúca,5957859,restaurante-review,Renato M,2016-11-03,2016-09-26,3.0,"NORMAL","Tira-gosto saborosos, cerveja gelada, atendimento razoável. Mas, atendeu prontamente as nossas expectativas. Indo a Diamantina, convém conferir.",indef
Café a Baiúca,5957859,restaurante-review,Tais_Ker,2016-10-25,2016-10-26,2.0,"Deixou a desejar","Pedimos dois pratos que deixaram muito a desejar. Primeiro, a quantidade de comida de um dos pratos era suficiente para 04 pessoas e quem nos atendeu recomendou que pedíssemos um segundo prato, ou seja, foi um desperdício. Um deles era um medalhão com molho de gorgonzola e mel. Primeiro que não tinha nada de medalhão e o molho estava com uma aparência bem estranha e só predominava o mel, ficou doce. A picanha, o outro prato, veio super passada, não era bem passada, era esturricada mesmo. Não recomendo. Já os sucos, estavam ótimos e só.","Santo André, SP"
Café a Baiúca,5957859,restaurante-review,jvalarini,2016-10-21,2016-08-26,5.0,"Excelente lugar para relaxar em Diamantina.","Lugar com cerveja gelada, ótimas porções,e localização excelente. Um bom lugar para se reunir com amigos.","Ouro Preto, MG"
Café a Baiúca,5957859,restaurante-review,Rodolfo G,2016-10-19,2016-09-26,4.0,"Buffet por quilo com muito boa qualidade","Buffet por quilo com muito boa qualidade e variedade, não émuito barato mas vale a pena. Pertinho do Mercado Velho.",indef
Café a Baiúca,5957859,restaurante-review,LucianoM1407,2016-10-17,2016-01-26,5.0,"Muito mais que café","Você não precisa gostar de café para visitar a Baiuca... apesar do nome, lá você encontra de tudo. No carnaval, é garantia de festa.",indef
Café a Baiúca,5957859,restaurante-review,399MarisaC399,2016-10-10,2016-07-26,3.0,"Cardápio limitado. Serviço atencioso.","Fomos atendidos durante a Vesperata. O cardápio é bastante limitado, com opções simples, mas saborosas. Carta de vinhos bem limitada, mas com preços razoáveis.","Brasília, DF"
Café a Baiúca,5957859,restaurante-review,Martins O,2016-09-28,2016-07-26,5.0,"Passeio","Bom espaço para se degustar uns tira gosto, bebendo umas cervas bem geladas, no Centro de Diamantina. Este bar fica na rua da Saudade, local onde é realizada a Vesperata. Ideal tambem para um fim de noite, após o encerramento deste maravilhoso evento. Recomendo.",indef
Café a Baiúca,5957859,restaurante-review,mluiz7,2016-09-26,2016-09-26,3.0,"Atendimento","Boa localização. Bom atendimento dos garçons com destaque para o Edgar, mas os petiscos não são tão gostosos como eu esperava.","Rio de Janeiro, RJ"
Café a Baiúca,5957859,restaurante-review,RosemaryDasilva,2016-09-15,2016-09-26,4.0,"Na Baiúca","Muito bem localizado,frequentado pela população local e pelos turistas.Muitos petiscos gostosos, coquetéis,sucos e cervejas bem geladas,Os preços até que não estão tão altos.Os garçons,alguns são rápidos e outros nem tanto.,mas todos sao educados e simpáticos.","Belo Horizonte, MG"
Café a Baiúca,5957859,restaurante-review,Leonardo D,2016-09-13,2016-09-26,4.0,"Para petiscar","Bar com boas opções de petiscos e cerveja gelada, as cadeiras são dispostas na rua, o que torna um pouco desconfortável pois fica na ladeira.",indef
Café a Baiúca,5957859,restaurante-review,Juciene A,2016-09-13,2015-12-26,4.0,"Excelente ambiente","Cerveja gelada e gente bonita, melhor horário é a noite pois ele fica situado no centro, então, não tem muito problema com acessibilidade, e fica pertinho de tudo.",indef
Café a Baiúca,5957859,restaurante-review,Cidafialho,2016-08-27,2016-08-26,5.0,"Muito bom!","Bar com bom atendimento.Bebidas geladas e bons tira gostos.Assisti à vesperata nesse bar.Foi muito bom!",indef
Café a Baiúca,5957859,restaurante-review,Maurineia M,2016-08-24,2016-08-26,3.0,"café a baiuca","Local agradável , serviço bom. Apesar de estar sempre com muitos clientes deixa a desejar um melhor cardápio.Poucas opções para almoço.",indef
Café a Baiúca,5957859,restaurante-review,jeodete,2016-08-08,2016-08-26,4.0,"cerveja gelada","Muito atenciosos, cerveja geladinha. tira gosto quentinho e o atendimento satisfatório.Bem central . E o café também é bom.","Divinópolis, MG"
Café a Baiúca,5957859,restaurante-review,Hemerson161974,2016-07-23,2016-07-26,5.0,"Noite romântica. ","Foi uma noite especial. Levei a minha namorada para festejar seu aniversário. Atendimento especial e lugar aconchegante. Recomendo aos meus amigos.","João Monlevade, MG"
Café a Baiúca,5957859,restaurante-review,gjuniorlemos,2016-07-09,2016-07-26,3.0,"Bem localizado","Localizado no centro histórico, porem devido a falta de pratica ou treinamento os garçons demoram a atender, cerveja estava gelada e os petiscos saborosos, porem atendimento muito deficitário.","Belo Horizonte, MG"
Café a Baiúca,5957859,restaurante-review,geisonm62,2016-07-09,2016-01-26,4.0,"Super agradável","Fica bem localizado, possui um cardápio muito sofisticado, cerveja geladinha, muito aconchegante o ambiente. Recomendo.","Teófilo Otoni, MG"
Café a Baiúca,5957859,restaurante-review,lauraoliveira16,2016-07-04,2016-02-26,5.0,"Ponto Central!","Fica no centro histórico de Diamantina, oferece um clima descontraído e ao mesmo tempo, tradicional...","São João da Ponte, MG"
Café a Baiúca,5957859,restaurante-review,Vania136,2016-06-27,2016-06-26,4.0,"tarde de bate papo","bar legal nada extraordinário, atendimento razoável, eramos 10 casais pedi cadeiras parta 4 pessoas do grupo que estava de pé nao fizeram nenhuma questão de arranjar , achei que faltou interesse no atendimento.","Caratinga, MG"
Café a Baiúca,5957859,restaurante-review,glauciamelo_balu,2016-06-26,2016-06-26,5.0,"Belo ponto para curtir um fim de tarde ","Cardápio com variedade de bebidas, comidas e atendimento de ótima qualidade. Um fim de tarde é excelente para curtir o local.","Brasília, DF"
Café a Baiúca,5957859,restaurante-review,Virgínia Guia C,2016-06-22,2016-06-26,5.0,"O Charme da Rua da Quitanda","Bom atendimento.Local arejado e aconchegante. Boa culinária. Localização no Centro Histórico de Diamantina.",indef
Café a Baiúca,5957859,restaurante-review,Denise P,2016-06-21,2016-01-26,5.0,"Saudades de Diamantina","Os bares que extendem-se as ruas e me faz ter saudades de Diamatina é com certeza Café e Baiúca. Nada tão brasileiro e acolhedor. Olhar as construções e se divertir ao mesmo tempo. E de passagem lembrei agora das Vesperatas.",indef
Café a Baiúca,5957859,restaurante-review,Andrea B,2016-06-02,2016-05-26,4.0,"Tradicional","Um bom café para ninguém colocar defeito! Eu amo café, então sou suspeita para falar. O quiche sempre quentinho.",indef
Café a Baiúca,5957859,restaurante-review,memoriaativa m,2016-06-02,2016-05-26,3.0,"Só vale pela localização. O banheiro é horrível","Está bem localizado, num local agradável, no miolinho do centro histórico. Estivemos no domingo, no final da manhã. O atendimento foi muito lento. A cerveja estava bem gelada. Desistimos de pedir algo para comer depois que fui ao banheiro. O aspecto no interior da casa é sujo e bagunçado. O acesso ao banheiro é péssimo e as instalações horrrosas. Não dá para comer num lugar assim.","Lagoa Santa, MG"
Café a Baiúca,5957859,restaurante-review,25andref,2016-06-01,2016-06-26,3.0,"Tradicional","É um bar bacana para tomar um chopp e petiscar, está bem localizado no miolinho de Diamantina. Durante as vesperatas, é possível, com alguma sorte, conseguir uma mesa para assistir à apresentação sem pagar por assentos.",indef
Café a Baiúca,5957859,restaurante-review,JulianaHorta,2016-05-29,2016-05-26,3.0,"Perde por pouco","O café/bar possui ótima localização, bem no centro de Diamantina, está sempre cheio e possui boas opções em seu cardápio, com atenção ao bolinho de creme de milho e carne seca. O que o bar deixa muito a desejar é nas suas instalações. O banheiro é horrível, sujo e com ar de abandono. Os salões são mal aproveitados sem charme algum o que aparenta que os proprietários não se preocupam com o conforto de seus clientes. Lamentável esta postura. O café/bar parece um butiquim copo sujo qualquer.","Belo Horizonte, MG"
Café a Baiúca,5957859,restaurante-review,Simone D,2016-05-24,2016-05-26,4.0,"Bem localizado","O bar fica no centro da cidade e tem mesas que são postas no meio da rua. é muito gostoso tomar uma cerveja e olhar o movimento. As comidas estavam gostosas, mas sinceramente esperava um pouco mais de um restaurante mineiro.",indef
Café a Baiúca,5957859,restaurante-review,geostorino2015,2016-05-20,2016-03-26,4.0,"Local agradável e comidinhas rápidas","Local agradável e fácil acesso. Fica animado nos finas de semana. O preço é bom dos sanduíches. Os sucos ótimos. Recomendo.","Belo Horizonte, MG"
Café a Baiúca,5957859,restaurante-review,Lucas H,2016-04-27,2015-06-26,4.0,"Ótimas porções!","O Café Baiuca é um dos mais tradicionais de Diamantina. Oferece além de um cardápio variado, ótimas porções nos períodos de inverno! Vale a pena conferir as opções. Recomendo ir quando estiver acontecendo a vesperata!",indef
Café a Baiúca,5957859,restaurante-review,Aparecida Marti... M,2016-04-01,2015-11-26,5.0,"muito bom","Um lugar muito bom,principalmente a noite e em dias de vesperata.A comida muito boa e o atendimento maravilhoso.Porem a preço é um pouco salgado,pelo fato de ser no coração de Diamantina.",indef
Café a Baiúca,5957859,restaurante-review,guiubastos,2016-03-29,2016-02-26,3.0,"restaurante razoavel","apesar da comida ser boa, achei ter poucas opções pelo preço, o ambiente também não e muito bom, muito apertado","Cachoeira do Campo, MG"
Café a Baiúca,5957859,restaurante-review,Rodrigoclemente,2016-03-26,2016-03-26,4.0,"Cerveja e história","Na esquina dos becos no centro histórico de Diamantina, tome uma cerveja ou café em mesinhas no calçadão cercado de casarões do sec XVIII inclusive o própio bar está em um casarão antigo, destaque para o Hamburger artesanal excelente da casa.","Belo Horizonte, MG"
Café a Baiúca,5957859,restaurante-review,zau2016,2016-03-22,2015-08-26,4.0,"Cerveja gelada e História","Entre casarões históricos está esse lugar agradável para tomar uma cervejinha e comer uns petiscos com os amigos.","Tietê, SP"
Café a Baiúca,5957859,restaurante-review,Vanderleiaribeiro,2016-03-14,2016-02-26,4.0,"Bom!","O lugar é agradável, fica no centro da cidade e as mesas são colocadas na rua. O clima da cidade é bem fresco o que favorece o encontro de amigos ou família. Os preços são razoáveis, mas a cerveja é gelada e o tira gosto gostoso! Inclusive tem várias opções no cardápio.","Montes Claros, MG"
Café a Baiúca,5957859,restaurante-review,Elizabeth A,2016-03-12,2015-10-26,4.0,"Simpático","Lugar agradável para uma pausa e um café após uma caminhada. Atendimento bom; preço justo; custo x benefício perfeito",indef
Café a Baiúca,5957859,restaurante-review,AdautoResende,2016-03-12,2015-07-26,5.0,"Alto nível e tradição...","O cardápio variado e a presteza dos garçons fazem a diferença da Baiuca. A carta de cervejas diferentes e os tiragostos bem feitos só completam o quadro de qualidade. O ponto, bem na esquina da praça onde se realiza a Vesperata é outro ponto positivo.","Belo Horizonte, MG"
Café a Baiúca,5957859,restaurante-review,Adriana E,2016-03-09,2016-02-26,3.0,"Nada demais!","Está localizada na Rua da Quitanda, no centro da cidade. Há diversas mesas na área externa, ambiente tranquilo. Bom atendimento, porém o prato demora muito a chegar na mesa. Meu marido e eu provamos os hamburgueres artesanais (carne vermelha e salmão). Meu marido aprovou o de carne vermelha, mas o meu chegou tostado demais, pra não dizer queimado. Não gostei! Os preços são razoáveis em relação aos outros estabelecimentos em volta.","Brasília, DF"
Café a Baiúca,5957859,restaurante-review,Matheus B,2016-02-26,2015-10-26,4.0,"Melhor bar para beber e conversar","O bar mais agitado de Diamantina. Oferece boas opções no cardápio e cerveja sempre gelada. Recomendo.",indef
Café a Baiúca,5957859,restaurante-review,Claricefonseca,2016-02-01,2016-01-26,2.0,"Vale a pena pela localização","De cara, achamos o lugar super agradável, com mesinhas na rua e decoração atraente. Mas a cozinha deixa muito a desejar, principalmente porque a higiene do local não causa boa impressão, Além disso, o prato que pedimos não correspondeu à descrição do cardápio, mas como demorou horrores para ser servido, comemos, pois estávamos mortos de fome. O banheiro é medonho e o trajeto mais ainda. Hello, vigilância sanitária!",indef
Café a Baiúca,5957859,restaurante-review,Eduarda A,2016-01-21,2015-09-26,4.0,"ponto de parada de todas as tardes","uma bom lugar para um cerveja gela e uns petiscos,fica em uma ótima localização, e é um ambiente agradável. O único defeito é o banheiro.",indef
Café a Baiúca,5957859,restaurante-review,Lilymartins1,2016-01-16,2016-01-26,3.0,"Ambiente normal","Fomos em uma sexta feira chuvosa durante a tarde. Tinham poucas pessoas, experimentamos algumas das opções de cervejas especiais. O chopp da backer é uma boa pedida. Os funcionários são muito prestativos e legais. Mas achei o ambiente um pouco esquecido, o banheiro por exemplo não tinha nem papel.","Rio de Janeiro, RJ"
Café a Baiúca,5957859,restaurante-review,Bruno-Queiroz-Pinto,2016-01-09,2016-01-26,1.0,"Péssimo atendimento","A estrutura é boa, pareceu ser uma ótima opção... Mas o atendimento foi muito ruim, lento e impreciso... Precisamos chamar o garçom para perguntar da porção que pedimos, demorou muito.... Foi uma porção de batata com queijo, quando chegou, outra decepção, a batata frita estava longe de estar crocante, estava muito oleosa, deixamos mais da metade da porção... Foi em um sábado a tarde, havia umas cinco mesas, ou seja não havia justificativa, e todas as mesas estavam reclamando... A cerveja é o que salva.... Não recomendo...","Uberlândia, MG"
Café a Baiúca,5957859,restaurante-review,FelipeturTraslados,2015-12-29,2015-12-26,5.0,"Melhor local em Diamantina para tomar Cerveja.","Sempre quando vamos a diamantina gostamos de tomar umas no café a baiuca. O local é super agradável e tem uma visão bem legal dos casarões da cidade, onde acontece as vesperatas. A cerveja é sempre bem gelada, tem várias opções de petiscos Super recomendamos!","Fortaleza, CE"
Café a Baiúca,5957859,restaurante-review,pl_nion310,2015-12-29,2015-12-26,2.0,"Atendimento ruim num sábado a noite","Atendimento demorado (1h30min!!), comida ruim, conta errada e preço caro. Enfim, nossa experiência não foi boa...","Anápolis, GO"
Café a Baiúca,5957859,restaurante-review,kamillaaraujos,2015-12-11,2015-01-26,5.0,"Excelente","Local agradabilíssimo, com ótima musica. Excelentes petiscos e opções de cervejas artesanais. Atendes sempre muito atenciosos.","Brasília, DF"
Café a Baiúca,5957859,restaurante-review,Wagner G,2015-12-09,2015-12-26,4.0,"Muito agradável.","Sentei-me a uma das mesas externas numa tarde quente de verão. Lugar muito agradável para uma pausa, um petisco e observar o movimento da cidade histórica. O cardápio tem ótimas opções para tira gosto e cervejas artesanais. Recomendo pedir as cervejas artesanais fabricadas na própria Diamantina! Muito saborosas.",indef
Café a Baiúca,5957859,restaurante-review,eyreCarvalho,2015-12-08,2015-10-26,4.0,"onde tudo acontece. a manhã tranquila e gostosa","tudo muito bem feito. Com muito carinho. população da cidade é muito acolhedora. muitas opções de lazer.","São João Evangelista, MG"
Café a Baiúca,5957859,restaurante-review,Anderson_Chagas2014,2015-11-26,2015-11-26,4.0,"Localização ótima para apreciar a paisagem","Ficamos numa mesa na calçada do café. O local é muito bom. O atendimento que foi um pouco demorado. Acho que tinha muita gente para pouco garçon. Mesmo assim recomendo.","Recife, Pernambuco, Brazil"
Café a Baiúca,5957859,restaurante-review,josesica,2015-11-05,2015-10-26,4.0,"Oferece cerveja de qualidade e tira gostos","Ótimo para atender durante a VESPERATA. Infelizmente a distribuição dos ingressos é por sorteio. Cerveja gelada, batatas crocantes.","São Paulo, SP"
Café a Baiúca,5957859,restaurante-review,290silvanam,2015-11-03,2015-10-26,4.0,"Ótimo Passeio","O Café Baiúca é uma referência em Diamantina, com atendimento rápido e comida gostosa (experimente a carne de sol com mandioca frita). A cerveja sempre gelada e funcionários prestativos.","Belo Horizonte, MG"
Café a Baiúca,5957859,restaurante-review,Valdir_Jr,2015-10-27,2015-10-26,4.0,"Uma esquina pra se conhecer","Muito bem localizado o Café Baiúca esta sempre pronto para atender os clientes de forma alegre e eficiente. Recomendo o bolinho de milho com carne seca acompanhado de uma cerveja bem gelada.","São Paulo, SP"
Café a Baiúca,5957859,restaurante-review,Cézar G,2015-10-21,2015-10-26,3.0,"Pode melhorar","A cerveja sempre gelada, mas o molho da carne pedida pareceu ter bastante maisena. Pode melhorar. A localização é perfeita.",indef
Café a Baiúca,5957859,restaurante-review,Wesleylr,2015-10-20,2015-09-26,4.0,"Excelente Tira-gosto.","Uma grande variedade de porções e a cerveja mais gelada. No calor que estava o que eu queria mais. E o preço é dentro da media.","Belo Horizonte, MG"
Café a Baiúca,5957859,restaurante-review,Daianne F,2015-10-19,2015-10-26,5.0,"Cervejinha com os amigos","Melhor lugar de Diamantina para tomar uma cervejinha com os amigos durante a noite. O atendimento é bacana, mas o especial mesmo é a localização: no coração de Diamantina.",indef
Café a Baiúca,5957859,restaurante-review,ditadora,2015-10-15,2015-07-26,5.0,"PARA UM FIM DE NOITE AGRADÁVEL EM DIAMANTINA sÓ  NA BAIUCA.","Aberta até altas horas a Baiuca é a melhor opção.Bom tira gosto, Boa Bebida e o melhor lugar para um bom papo e fazer amigos.Vem p cá vc tbm.","Diamantina, MG"
Café a Baiúca,5957859,restaurante-review,paulav847,2015-10-13,2015-10-26,1.0,"Decepção ","O atendimento não foi bom e o petisco que pedimos, pastéis, não eram saborosos e mal feito. Saímos pra procurar outro bar.","Olinda, PE"
Café a Baiúca,5957859,restaurante-review,Misarsur,2015-10-13,2014-11-26,5.0,"Delicia!","Tome um delicioso café e se delicie com os deliciosos confeitos! Bem no centro de Diamantina. Tome café da manhã ou da tarde, Vale a pena!","Belo Horizonte, MG"
Café a Baiúca,5957859,restaurante-review,belalimaoliveira,2015-10-12,2015-10-26,4.0,"Típica!","Chop gostoso, tira gosto melhor ainda. Preço razoável para um local no coração da cidade histórica. Boa pedida para fim de tarde e noite.","Montes Claros, MG"
Café a Baiúca,5957859,restaurante-review,SorayaVS,2015-10-09,2015-10-26,4.0,"Bate papo na Esquina da Quitanda","Não deixe de passar por lá, é um bar relativamente pequeno, muito charmoso e com muito boa qualidade. Cerveja e chopp gelados, tira-gosto gostoso e, de quebra, caso aconteça a Vesperata reserve o seu lugar porque você está no coração de Diamantina. O atendimento é muito bom e a turma se diverte a beça por lá.","Belo Horizonte, MG"
Café a Baiúca,5957859,restaurante-review,EduardoMotta,2015-10-01,2015-09-26,5.0,"Melhor Chopp no Coração de Diamantina.","Chopp Geladíssimo, muito bem localizado, o Gerente Robinho super atencioso e divertido, caso esteja indo para assistir a Vesperata, reserve uma mesa gratuitamente e fique muito bem localizado no espetáculo. As porções são muito boas e a decoração é uma volta ao passado.","Itapetininga, SP"
