estabelecimento,estabelecimento_id,estabelecimento_tipo,usuario,data_avaliacao,data_visita,nota,titulo,conteudo,origem
Grupiara,2390013,restaurante-review,Devair N,2018-07-25,2018-07-26,3.0,"Se não tiver opção melhor.","Os atendentes eram novos e não conheciam bem o cardápio,mas se esforçavam em atender bem, apesar da visível falta de preparo. Vários itens que estavam no cardápio estavam faltando no restaurante. Falta opções de comida mineira.",indef
Grupiara,2390013,restaurante-review,WagnerSatel,2018-07-24,2018-07-26,2.0,"Lamentavelmente lento","Localizado bem no centro histórico ao lado de diversos bares.
Depois de entrar em vários bares para jantar, resolvemos optar por este, por seu espaço interno ser legal e com alguns pratos típicos que queria experimentar.
Como estava com um filho pequeno e outro adolescente, pedi logo de imediato 3 pratos, sendo um omelete, por rápido, já poderíamos já ir degustando.
Pedi um acerveja artesanal Diamantina, (que foi a única coisa boa servida).
Ficamos esperando por 1:15 quando chegou apenas um prato, que era o regional (carne serenada)....que carne não tinha quase nada, apenas os grãos de feijão, que pela minha fome comi quase todo.
Resolvi cancelar os demais e ir de frente ao O Caipirão e pedi uma pizza e chegou rapidão.
Resumindo, não foi legal....não volto e nem recomendo.","Uberlândia, MG"
Grupiara,2390013,restaurante-review,Marcia S,2018-07-16,2018-07-26,3.0,"Demorou muito","Pedimos um filé à parmegiana para jantar, q demorou cerca de 1h20 para ficar pronto, e nem ficou tão bom. Pela fama do lugar, esperava mais...",indef
Grupiara,2390013,restaurante-review,533robertow,2018-07-14,2018-07-26,1.0,"Experiência ruim em Diamantina ","Ambiente simples e agradável, mas deixou muito a desejar em relação à comida. Pedimos mandioca frita, que veio dura e em parte crua. Carne maturada, encharcada no óleo. E um caldo verde, que estava bom, mas sem aviso prévio que servia 4 pessoas. Outro ponto negativo é que tivemos que esperar mais de uma hora pelos petiscos.","Vitória, ES"
Grupiara,2390013,restaurante-review,LucasC2919,2018-06-04,2018-06-26,1.0,"Péssimo em todos os sentidos.","Péssima experiência. Fui jantar com minha noiva e nos decepcionamos.
1- Nos sentamos e a garçonete, ao invés de anotar nosso pedido, ficou conversando com o pessoal de outra mesa, coisas que não tinham nada a ver com o serviço dela.
2- Pedimos uma porção (carne, batata...) que em qualquer lugar chegaria em 20 a 30 minutos, Mas saímos sem comer.
3- uma hora depois pedimos a garçonete para verificar nosso pedido (a mesma que ficou conversando) e ela volta, vai em várias mesas e vai pro caixa, não nos informou sobre nada.
4- precisamos pedir a outro garçom para verificar o pedido e, depois de 1h15 esperando, a porção levaria mais 15 minutos.

Assim, cancelamos a porção e fomos embora.

Obs:: clientes que chegaram após, receberam seus pedidos antes.

Pior experiência que já tive em Diamantina. Servico ridículo.",indef
Grupiara,2390013,restaurante-review,rafaelliberatobr,2018-05-02,2018-05-26,4.0,"Comida de ótima qualidade","Fomos muito bem atendidos. Chegamos muito tarde para o almoço. A comida demorou uns 40 minutos para sair, mas saboreamos uma comida fresquinha e deliciosa. Estávamos em quatro. Pedimos meia porção do prato chamado Suruba e meia porção do Tornedor que estava especialmente saboroso!","Belo Horizonte, MG"
Grupiara,2390013,restaurante-review,marialuiza1995,2018-04-17,2018-04-26,4.0,"Caldo delicioso!","O restaurante é pequeno, com decoração bem simples, mas com um caldo verde delicioso!
Caminhando por Diamantina, em busca por um lugar para jantar, encontramos o restaurante Grupiara, em uma ruazinha estreita do centro histórico. Não ligue para as instalações, a comida é muito gostosa. Pedimos aipim frito e caldo verde. A garçonete, bastante atenciosa, indicou-nos meia porção, que seria suficiente. E foi.
Além de tudo gostoso, o preço é decente: R$47,00 para 2 pessoas.
Voltaremos para experimentar mais comida típica mineira.","Rio de Janeiro, RJ"
Grupiara,2390013,restaurante-review,Cláudia M,2018-02-15,2017-12-26,4.0,"Tradicional","Localizado bem no centro de Diamantina, o Grupiara tem um bom cardápio, com comida boa, variada e farta, cervejas geladas, bom atendimento. É uma ótima opção para quem quer almoçar ou jantar, sem perder nada do que acontece no burburinho da cidade.",indef
Grupiara,2390013,restaurante-review,rosioliveira81,2018-01-12,2018-01-26,4.0,"Comida boa","O restaurante fica bem localizado, com algumas mesas na rua e outras internas. Fomos na primeira noite que estávamos em Diamantina, mas estavam faltando várias marcas de cerveja devido ao feriado do réveillon. Voltamos no outro dia e tinha algumas marcas de cerveja como opção. O atendimento é ótimo, destaque para o Luan que fez todo o possível para nos atender bem. A comida é farta e saborosa, porém demora um pouco pra vir. Dentro existem ventiladores muito potentes que atrapalham um pouco quem está por perto deles. Mas em resumo, eu voltaria só pra comer de novo a parmegiana deles, que é maravilhosa!","São Paulo, SP"
Grupiara,2390013,restaurante-review,celsotavares,2018-01-03,2017-12-26,4.0,"Ótimo!","Atendimento excelente, cervejas geladas, comidas feitas na hora e de qualidade. Torresmo crocantíssimo! Ótimo o Mignon com arroz à Loulena e salada. Porções fartas. Servem, a pedido, alguns pratos em meia porção. Local excelente, junto á praça principal.","Rio de Janeiro, RJ"
Grupiara,2390013,restaurante-review,maryzaidan,2017-10-26,2017-10-26,4.0,"Boa comida e muito farto","Típica comida mineira em um local despojado, sem qualquer luxo, mas agradável. Tem algumas poucas mesas na calçada, essenciais em dias de muito calor. Pratos fartíssimos, que servem 3 a 4 pessoas a preços módicos. Meia porção serve duas pessoas. Comemos um lombo, que derretia de tão macio, servido com batatas coradas, arroz e farofa de ovo. Atendimento nota 10, feito pelo Luan.","São Paulo, SP"
Grupiara,2390013,restaurante-review,Maia374,2017-10-22,2017-10-26,3.0,"Muita comida!","Esperava Mais desse restaurante, pedimos um Frango ao molho pardo, que estava ok! E serviu Bem 3 pessoas. Trata-se de um restaurante simples e popular, para quem gosta de fartura e comida mineira.","São Paulo, São Paulo, Brazil"
Grupiara,2390013,restaurante-review,rrpart,2017-10-12,2017-01-26,1.0,"Não recomendo","Atendimento demorado. Tiveram o despropósito de servir uma feijoada rala e completada com salsicha. Talvez seja uma opção para tira-gosto nas mesas de fora.","Belo Horizonte, MG"
Grupiara,2390013,restaurante-review,wannut,2017-10-08,2017-10-26,4.0,"Porção generosa","Bem boteco no meio da rua. Pra quem gosta de um pouquinho mais de agitação, pois fica na região da Baiuca. A porção é caprichada e a atendimento é bom. Recomendo!","Diamantina, MG"
Grupiara,2390013,restaurante-review,Luiz A,2017-09-27,2017-09-26,3.0,"Simples e bem localizado","Um restaurante simples com bufê de comida mineira a kilo e carne de churrasco fatiada. Preços justo. Pouco espaço como todos os outros da Cidade",indef
Grupiara,2390013,restaurante-review,565talital,2017-08-23,2017-08-26,5.0,"Típica comida mineira","É servida a tipica comida mineira! Muito saborosa! Otimo atendimento! Bem proximo da rua da Quitanda... excelente!","Rio de Janeiro, RJ"
Grupiara,2390013,restaurante-review,larissa s,2017-08-22,2017-07-26,4.0,"Quantidade de comida agradável ","Preço normal, quantidade de comida no prato é boa! Parmeggiana delicia! Só o bacon da batata frita que eu pediria mais frito! Apenas detalhe! Mas tudo muito bom! Voltaria lá!",indef
Grupiara,2390013,restaurante-review,JanainaK36,2017-08-21,2017-08-26,5.0,"Melhor file a parmegiana","pedimos um file a parmegiana, e veio uma carne incrivel, com um molho a bolonhesa pura carne, com um pure delicioso. Refeição serve duas pessoas com fome tranquilamente, e sem contar que o ambiente e extremamente agradavel.",indef
Grupiara,2390013,restaurante-review,rrc1708,2017-08-04,2017-06-26,4.0,"Boas porções ","O restaurante tem boas porções com preço justo. Fica bem localizada em uma das ruelas principais de Diamantina, bem no centro, próximo da igreja matriz. Atendimento bom, tem Wi-Fi para os clientes, decoração simples.","São Paulo, SP"
Grupiara,2390013,restaurante-review,marcosviajmoto,2017-07-14,2017-07-26,4.0,"Fartura mineira","Localização estratégica, no largo onde acontecem as Vesperatas. Pratos fartos e ótimos preços. Variedade em cervejas. Bom custo-benefício!","São Paulo, SP"
Grupiara,2390013,restaurante-review,FernandaResendeMK,2017-05-08,2017-05-26,3.0,"Comemoração ","Já estivemos no restaurante alguns anos atrás , ficou a desejar no quesito comida , porém excelente atendimento e bebida geladíssima","Viçosa, MG"
Grupiara,2390013,restaurante-review,Luiz Fernando N,2017-04-15,2017-04-26,2.0,"Não volto nunca mais!","Ambiente apertado, preparo da refeição demorou 1 hora e 30min, faltou ingredientes como dito no cardápio, wifi não funciona, atendimento é fraco.",indef
Grupiara,2390013,restaurante-review,Jminhauma,2016-12-04,2016-11-26,4.0,"Comendo e tocando viola.","Pratos típicos muito saborosos. Cerveja gelada e permite que você se reuna com os amigos tocando uma boa viola, desde que o som se faça agradável aos demais.","Sete Lagoas, MG"
Grupiara,2390013,restaurante-review,Renato M,2016-11-03,2016-09-26,3.0,"BOM SABOR","Restaurante pequeno mas com bom sabor, ou seja, comida saborosa e preço justo. A quantidade das refeições é que supera as expectativas, é muita comida. Os pratos servem 2 a 3 pessoas que comem bem. Visitando, avalie primeiro, rsrs.",indef
Grupiara,2390013,restaurante-review,Juliaceno,2016-10-23,2016-10-26,3.0,"Nada de excepcional, mas mata a fome","A comida não é maravilhosa, é simples e mata a fome! O atendimento deixou muito a desejar na sexta, mas foi bem melhor no sábado quando estava mais cheio e não consegui entender!!","Contagem, MG"
Grupiara,2390013,restaurante-review,Hugo P,2016-10-09,2016-10-26,4.0,"Fartura! ","Cerveja gelada, comida muito farta. Filé à Parmegiana para 2 pessoas com certeza serve 4 pessoas com muita fome! Localizado ao lado da rua da Quitanda! Boa opção para jantar nos fds de Vesperata!",indef
Grupiara,2390013,restaurante-review,Karênina A,2016-09-23,2016-08-26,3.0,"Demora e má apresentação","Restaurante bem localizado e por fora aparenta ser um ambiente gostoso. Mas por dentro deixa a impressão de má higiene. A refeição demora MUITO para ficar pronta. Não chegue com fome!",indef
Grupiara,2390013,restaurante-review,Verenice P,2016-09-22,2016-09-26,4.0,"Delícia de restaurante","Comida deliciosa, tudo muito limpo, próximo ao Mercado e da Catedral. A comida é temperadinha. Delícia!",indef
Grupiara,2390013,restaurante-review,MAmeliaC,2016-09-21,2016-09-26,4.0,"muito bom","Aparentemente não é muito agradável! Restaurante de aparência simples, mas com uma comida muito saborosa!","Piquete, SP"
Grupiara,2390013,restaurante-review,O5772MPsilviac,2016-09-18,2016-09-26,4.0,"Restaurante","Almocei neste restaurante duas vezes, voltei Pq adorei a comida. Tudo feito com muito capricho. Excelente atendimento, comida farta e preço muito justo.","São Joaquim, SC"
Grupiara,2390013,restaurante-review,579eduardol,2016-09-18,2016-09-26,4.0,"Melhor opção","Comida espetacular, mesmo sem os requintes que encontramos nas cidades grandes. Tudo bem feito e fresco, comida mineira de valor e saborosa. Boas mesas. Algumas cadeiras ficam no sol. Ventiladores potentes atrapalham um poucom","Rio de Janeiro, RJ"
Grupiara,2390013,restaurante-review,RosemaryDasilva,2016-09-17,2016-04-26,4.0,"Pertinho de tudo","O restaurante Grupiara,é bem localizado, e serve comida mineira muito boa.É uma boa opção para um domingo em Diamantina,quando depois do almoço,todo comércio fecha. Um bom cardápio e preços até moderados. Recomendo a costela de porco ao molho barbecue.","Belo Horizonte, MG"
Grupiara,2390013,restaurante-review,adilsoncloviso,2016-09-07,2016-09-26,4.0,"Comida mineira","Bons pratos, muito bem servidos. Atendimento ótimo, qualidade e fartura dos pratos. Impossível não ficar satisfeito.","Belo Horizonte, MG"
Grupiara,2390013,restaurante-review,Fatinha27,2016-08-30,2016-08-26,2.0,"Atendimento ruim","Nem sequer consegui avaliar o sabor da comida pois esperei 50 minutos por uma sopa e não consegui ser atendida. Era fim de semana de Vesperata e aparentemente a casa não se preparou para receber turistas. Cancelei meu pedido e fui embora!","Belo Horizonte, MG"
Grupiara,2390013,restaurante-review,AnaMendes_2013,2016-08-25,2016-07-26,2.0,"Esperava mais.","Recebemos boas recomendações deste local, porém saí decepcionada. O restaurante é bem localizado, porém pequeno. O atendimento não foi bom com garçonetes de cara amarrada e esperamos acredito que mais de 01 hora para sermos servidos, por sinal tivemos até que fazer uma reclamação quanto a isso. Pedimos um File a Parmegiana que é generoso/completo e alimenta umas 04 pessoas tranquilamente, porém foi outra decepção, pois achei o tempero meio exagerado e o filé não estava suculento. Com certeza já comi outros muito melhores. Tem um cardápio amplo, mas pode melhorar bastante em outros aspectos.","Itabira"
Grupiara,2390013,restaurante-review,766m_nicap,2016-08-24,2016-08-26,3.0,"Pode melhorar","O restaurante é simples, mas tem um excelente atendimento. Os pratos são bem servidos. Creio que podem melhorar detalhes de arrumação do ambiente.","Brasília, DF"
Grupiara,2390013,restaurante-review,PauloIwamoto,2016-08-17,2016-08-26,5.0,"Delícia de filé ","Local é bem localizado, atendimento é top e muito bem servido!!! Tomem cuidado porque os pratos vem muita coisa, hein! Aqui neste restaurante, não tem como deixar de pedir aquela porção de torresmo de entrada e aquela cerveja bem gelada! Aí, conversa vai, conversa vem e a porção acaba ...sugerindo um delicioso filé à moda da casa! Pode ir com a galera, com a família sem problema nenhum, mas se for em casal peçam meia porção! Porque vem muita coisa;) recomendo","Izumo, Japão"
Grupiara,2390013,restaurante-review,flavinha_zanini,2016-08-11,2016-08-26,4.0,"Comida de qualidade","Comida farta e muito boa a preço justo. Os pratos servem tranquilamente para duas pessoas, talvez até 3. Quase na esquina da rua da quitanda.","Bauru, SP"
Grupiara,2390013,restaurante-review,siliunes,2016-08-07,2016-08-26,4.0,"Almoço tarde","Lugar bem central com mesas do lado de fora. Não demos muita sorte e o atendimento estava precário. Tivemos que entrar para pedir para sermos servidos. O pedido veio até rápido mas trocaram a mandioca que era cozida para frita! Acho que demos azar pelo horário!","Brasília, DF"
Grupiara,2390013,restaurante-review,RegiCorrea,2016-08-02,2016-07-26,5.0,"Uma agradável surpresa","Final de semana de vesperata, cidade cheia. Conhecemos o Grupiara meio sem querer, meu filho de 8 anos faminto e como tinha mesa fomos nele mesmo. Mas olha a surpresa, pratos variados, deliciosos e bem servidos. Tinha um mexidão mineiro (aqui como nome de Surubão rsrsrs) excelente. Provei um prato com carne de porco e 'samambaia' delicioso demais. E a cerveja, na temperatura perfeita. Além do atendimento simpático de todo mundo. Simples, como pode ser e muito, muito bom.","São Paulo, SP"
Grupiara,2390013,restaurante-review,GomesAndrea,2016-07-27,2016-07-26,3.0,"Experiência no restaurante Grupiara","Variedade de pratos!! No horário do almoço além dos pratos a la Carte servem refeições (pratos montados) com preços bem em conta, e por isso fica bem cheio. Fiz duas refeições nesse restaurante uma janta (pedimos um tornedor ao alho e óleo carne veio em um pequeno caldeirão com bastante óleo e alho, nunca tinha visto e nem experimentado esse prato servido dessa maneira, achei que por isso a carne ficou muito bem passada quanto aos acompanhamentos ( farofa de ovos, arroz e batatas fritas) estavam ótimos. No almoço no dia seguinte pedimos um prato típico: Andu Serenado (feijão verde com carne de sol, angu, arroz e mandioca). O prato veio com a carne, feijão verde , ovos mexidos , brócolis tudo misturado e enfeitado com pedaços de angu e torresmo, parecia um mexidão com bastante caldo servido em uma panela de barro. A aparecia não agradou, o arroz e a mandioca vieram a parte. A carne estava super gordurosa e dura não atendeu as expectativas....","Rio de Janeiro, RJ"
Grupiara,2390013,restaurante-review,InforWord F,2016-07-26,2016-06-26,4.0,"Restaurante Super aconchegante!!!","Localizado no centro histórico de Diamantina, possui ótimos pratos, com tempero sem igual!! Os preços que são um pouco elevados, mas com um sabor que pode compensar!",indef
Grupiara,2390013,restaurante-review,adeoliveira31,2016-07-25,2015-08-26,4.0,"Ótima comida e cerveja gelada!","Comida deliciosa e ótimo atendimento. Opções de carnes muito apetitosas e cerveja gelada! Lugar simples mas a comida é saborosa e os pratos fartos. O restaurante funciona tanto no almoço quanto no jantar e o preço é justo para o serviço prestado.","Diamantina"
Grupiara,2390013,restaurante-review,lorerg2013,2016-07-24,2016-07-26,5.0,"Maravilhoso filé de frango com queijo ao alho","Dentre os restaurantes que eu conheci em Diamantina, o Grupiara é um que merece destaque. O lugar é simples, mas a comida é saborosa e farta e o preço é honesto. Ontem pedimos uma porção de picanha com fritas e uma porção de filé de frango com queijo ao alho. Os dois pratos vieram muito bem servidos: além de bonitos (visualmente bem apresentados), são fartos e deliciosos. Estávamos em cinco pessoas, quatro adultos e uma criança de 11 anos, e ficamos satisfeitos. Além disso, o atendimento é muito bom; as atendentes são gentis e educadas, a cerveja é gelada e o suco de laranja é feito na hora. Vale lembrar que o restaurante funciona nos horários do almoço e do jantar. No almoço, serve a La Carte e executivo. No jantar, somente a la carte. Durante a semana, a cozinha fecha por volta das 23 horas.","Belo Horizonte, MG"
Grupiara,2390013,restaurante-review,JaimaOliveira,2016-07-23,2016-06-26,4.0,"Comida muoto gostosa e cerveja geladinha","Fomos (eu e meu marido) almoçar nesse restaurante. Ele é pequeno, por isso, pode acontecer de ter que aguardar uma mesa melhor. A comida é maravilhosa e a cerveja é muito gelada. Recomendadíssimo!","Marília, SP"
Grupiara,2390013,restaurante-review,Simone O,2016-07-23,2016-07-26,5.0,"Ótima comida e atendimento!","Comida deliciosa e tem um ótimo atendimento!! Comida caseira. Os pratos são muito bem servidos. O atendimento é acolhedor.",indef
Grupiara,2390013,restaurante-review,Reginasat,2016-07-22,2016-07-26,4.0,"Comida boa e farta!","A comida é excelente mas o serviço é muito demorado. O ambiente é bem simples e rústico. Os pratos são muito fartos e saborosos!","Belo Horizonte, MG"
Grupiara,2390013,restaurante-review,Joisa2014,2016-07-15,2016-06-26,5.0,"Sabor inesquecível","O lugar é simples, mas a comida é maravilhosa!!!!!! Pedimos 3 tipos de pratos diferentes e todos estavam deliciosos! A comida mineira é a especialidade da casa.","Belo Horizonte, MG"
Grupiara,2390013,restaurante-review,Regina B,2016-07-13,2016-07-26,5.0,"Delícia ","Bom atendimento. Cerveja bem gelada. Pratos bem servidos e saborosos. Mesas na calçada , bem descontraído. Chegamos já à tarde pro almoço qdo vários outros já haviam encerrado.",indef
Grupiara,2390013,restaurante-review,avia922,2016-07-02,2016-06-26,4.0,"Grupiara","Nao é alta cozinha, até porque nao tenho bolso para 'Alta Cozinha rsrsrsr Sendo assim, mereceu um 4 na minha avaliação, muito bem localizado, preços convidativos para um cozinha honesta, se for jantar, peca um prato chamado Suruba Se for almoçar e o orçamento estiver apertado, peca o cardápio com os pratos do dia!","Sao Paulo"
Grupiara,2390013,restaurante-review,Beatriz L,2016-06-25,2016-06-26,3.0,"Tabuas fartas e deliciosas!","Ambiente simples, em uma das ruas estreitinhas da cidade, com tabuas muito gostosas e bem servidas e agradável para ir com amigos.",indef
Grupiara,2390013,restaurante-review,Denise P,2016-06-21,2016-01-26,5.0,"Legítima comida mineira","Deliciosa comida e ambiente agradável. Situado em local privelegiado após a refeição pede um passeio por suas ruas históricas.",indef
Grupiara,2390013,restaurante-review,psergioazevedo,2016-06-06,2016-03-26,3.0,"Restaurante Popular","Para os amantes da comida bem mineira este é o local. Preço bem acessível e ambiente simples. Tem na sua calçada mesas para um chopp e tira gosto ao ar livre.","Belo Horizonte, MG"
Grupiara,2390013,restaurante-review,ClarissaVeloso,2016-06-06,2016-06-26,4.0,"excelente para comer comida típica","pratos muito bem servidos, bom atendimento, comida de qualidade e bem preparada. ótimas opções de pratos típicos!","Belo Horizonte, MG"
Grupiara,2390013,restaurante-review,Andrea B,2016-06-02,2016-05-26,4.0,"Excelente opção!","Indico o bolinho de mandioca com catupiry e torresmo de entrada...hum, delícia!! para almoçar uma opção saborosa é viradão mineiro (tutú, arroz, couve, bisteca...acho que é isso).",indef
Grupiara,2390013,restaurante-review,memoriaativa m,2016-06-02,2016-05-26,4.0,"Comida saborosa e farta!","Fica localizado no centro histórico com mesinhas na calçada. Bom atendimento. A comida é simples, saborosa e farta, com preço honesto. Cerveja bem gelada. A melhor opção é sentar-se às mesas que estão na calçada. No interior dois aparelhos de televisão atrapalham bastante a conversa.",indef
Grupiara,2390013,restaurante-review,Ratin B,2016-06-01,2016-05-26,5.0,"um local na parte central da cidade","o melhor filé à parmegiana da cidade, um local onde se pode encontrar com amigos e beber uma bela cerveja gelada. Um dia estava em uma mesa que fica na porta do restaurante e na mesa ao lado um casal que estava visitando a cidade e eles comentaram comigo que a rua estava parecendo a Avenida Paulista, pois o movimento era intenso. Realmente e a rua que mais se passa em Diamantina. É o local que mais frequento.","Diamantina, MG"
Grupiara,2390013,restaurante-review,lorerg2013,2016-05-28,2016-05-26,4.0,"Ótima opção para almoçar e jantar","O restaurante serve um almoço executivo delicioso e com preço muito bom. A comida é caseira e feita no capricho. Estive lá também para jantar. Estava sozinha e falei com o garçom que estava com muita vontade de comer carne e salada. Ele me serviu um maravilhoso contra filé com salada, mesmo não tendo esta opção no cardápio.","Belo Horizonte, MG"
Grupiara,2390013,restaurante-review,FabioC474,2016-05-17,2016-05-26,5.0,"Comida boa e farta","Localizado no centro histórico, com comida variada e farta. Prato feito ou a la carte. Atendimento rápido, atencioso e com funcionários prestativos e simpáticos. Ótimo custo benefício.","Catanduva, SP"
Grupiara,2390013,restaurante-review,Nutricionista K,2016-05-01,2016-04-26,5.0,"Sensacional","Típica cozinha mineira, com tempero maravilhoso, muito saborosa. O atendimento é um diferencial do local. Fizeram uma adaptação no cardápio para atender nossa necessidade, meu namorado é vegano. Comida simples, saborosa, 100% mineiro e com preço acessível. Super Recomendo.",indef
Grupiara,2390013,restaurante-review,446Lili,2016-04-20,2016-04-26,5.0,"Delicioso ","O ambiente é muito simples, mas não se engane pelas as aparências porque a comida é muito gostosa e farta. Fomos muito bem atendidos. Recomendo o bolinho de aipim com queijo que é maravilhoso.","São José dos Campos, SP"
Grupiara,2390013,restaurante-review,rafael4vieira,2016-04-16,2016-03-26,3.0,"Não gostei","Esse restaurante tem um atendimento muito fraco. É preciso pedir aos garçons o mesmo pedido várias vezes. Escolhemos bolinho de bacalhau que servem bem 3 pessoas, mas são extremamente gordurosos por R$ 34,30.","Belo Horizonte, MG"
Grupiara,2390013,restaurante-review,virgilioalm,2016-03-27,2016-03-26,4.0,"Somente a la carte, com generosas porções","Se o garçon disser que o prato dá pra três, não acredite: todos os pratos que comemos foi mais do que suficiente para quatro comerem bem! Não é dos serviços mais rápidos, mas o atendimento é muito atencioso e a comida é deliciosa.","Brasília, DF"
Grupiara,2390013,restaurante-review,Clodio_Almeida,2016-03-25,2016-03-26,4.0,"Simples, mas excelente!","Se você quer uma boa comida típica de Diamantina, com certeza esse é o local. São poucas mesas e o serviço demora um pouco , mas vale a pena a espera. Os pratos são muito bem servidos (para 3 ou mesmo 4 pessoas), a um preço muito razoável. O frango ao molho pardo estava espetacular! Os atendentes são gentis e a cerveja gelada no ponto certo.","Belo Horizonte, MG"
Grupiara,2390013,restaurante-review,AdautoResende,2016-03-12,2015-07-26,5.0,"Comida mineira e cerveja gelada.","Estando próximo à Matriz de Diamantina, ou depois de uma Vesperata, o Grupiara é, com certeza uma grande pedida. Comida bem feita, atendentes educados e modestos mas bons de papo. Qualquer que seja seu estilo você tem grande chance de ficar bem servido. Acostumados com grandes movimentos os gerentes e funcionários não deixam por menos mesmo em dias bem movimentados. Profissionalismo aliado à tradição de comida mineira de qualidade.","Belo Horizonte, MG"
Grupiara,2390013,restaurante-review,Kobata,2016-03-05,2016-02-26,4.0,"Restaurante de culinária típica mineira.","Pedimos, minha esposa e eu, um virado à mineira (o nome no cardápio, não nos lembramos). Arroz, Tutú de feijão com torresminhos e ovos na cumbuca de barro, bisteca e couve refogadinha. Muito saboroso!","São José do Rio Preto, SP"
